{"deployment":{"environments":[]},"elements":[{"children":[],"description":"Buys things.","group":null,"id":"customer","modelId":"1","name":"Customer","parent":null,"properties":{},"tags":["Element","Person","buildzr-styleelements-f596a4905ef5"],"technology":null,"type":"Person","url":null,"views":["landscape","shop"]},{"children":["shop/api","shop/worker","shop/gateway"],"description":"Sells things.","group":null,"id":"shop","modelId":"2","name":"Shop","parent":null,"properties":{},"tags":["Element","Software System","buildzr-styleelements-ca7908b7173b"],"technology":null,"type":"SoftwareSystem","url":null,"views":["landscape","shop"]},{"children":[],"description":null,"group":null,"id":"shop/api","modelId":"3","name":"API","parent":"shop","properties":{},"tags":["Element","Container","Kubernetes - pod"],"technology":"Python","type":"Container","url":null,"views":["shop"]},{"children":[],"description":null,"group":null,"id":"shop/worker","modelId":"4","name":"Worker","parent":"shop","properties":{},"tags":["Element","Container","Kubernetes - pod"],"technology":"Python","type":"Container","url":null,"views":["shop"]},{"children":[],"description":"Routes the requests.","group":null,"id":"shop/gateway","modelId":"5","name":"Gateway","parent":"shop","properties":{},"tags":["Element","Container","Kubernetes - svc"],"technology":"Envoy","type":"Container","url":null,"views":["shop"]},{"children":[],"description":"Takes the money.","group":null,"id":"payments","modelId":"6","name":"Payments","parent":null,"properties":{},"tags":["Element","Software System","External"],"technology":null,"type":"SoftwareSystem","url":null,"views":["landscape","shop"]}],"modelHash":"sha256:b0cf156adc346f31f0af8891747e6e049f70c412b3eec0eee5170e501b0213a7","relationships":[{"description":"Uses","destination":"shop/gateway","id":"customer->shop/gateway","modelId":"7","properties":{},"source":"customer","tags":["Relationship"],"technology":null},{"description":"Charges","destination":"payments","id":"shop/api->payments","modelId":"10","properties":{},"source":"shop/api","tags":["Relationship","buildzr-stylerelationships-0cfcaaa3d732"],"technology":"HTTPS"},{"description":"Queues jobs for","destination":"shop/worker","id":"shop/api->shop/worker","modelId":"9","properties":{},"source":"shop/api","tags":["Relationship"],"technology":"AMQP"},{"description":"Forwards to","destination":"shop/api","id":"shop/gateway->shop/api","modelId":"8","properties":{},"source":"shop/gateway","tags":["Relationship"],"technology":null}],"schema":"buildzr.model/2","views":[{"description":"Everything.","key":"landscape","kind":"systemLandscape","scene":"v/landscape","scope":null,"title":"Everything.","viewKey":"landscape"},{"description":"The shop.","key":"shop","kind":"container","scene":"v/shop","scope":"shop","title":"The shop.","viewKey":"shop"}],"workspace":{"description":"Themes, icons and branding.","name":"Branded Shop"}}
