{"deployment":{"environments":[]},"elements":[{"children":[],"description":null,"group":null,"id":"customer","modelId":"1","name":"Customer","parent":null,"properties":{},"tags":["Element","Person"],"technology":null,"type":"Person","url":null,"views":["shop-containers","checkout","sign-in"]},{"children":["shop/web-app","shop/api","shop/database"],"description":null,"group":null,"id":"shop","modelId":"2","name":"Shop","parent":null,"properties":{},"tags":["Element","Software System","Internal"],"technology":null,"type":"SoftwareSystem","url":null,"views":["shop-containers"]},{"children":[],"description":null,"group":null,"id":"shop/web-app","modelId":"3","name":"Web App","parent":"shop","properties":{},"tags":["Element","Container"],"technology":null,"type":"Container","url":null,"views":["shop-containers","checkout","sign-in"]},{"children":[],"description":null,"group":null,"id":"shop/api","modelId":"4","name":"API","parent":"shop","properties":{},"tags":["Element","Container"],"technology":null,"type":"Container","url":null,"views":["shop-containers","checkout","sign-in"]},{"children":[],"description":null,"group":null,"id":"shop/database","modelId":"5","name":"Database","parent":"shop","properties":{},"tags":["Element","Container"],"technology":null,"type":"Container","url":null,"views":["shop-containers","checkout"]},{"children":[],"description":null,"group":null,"id":"payments","modelId":"6","name":"Payments","parent":null,"properties":{},"tags":["Element","Software System"],"technology":null,"type":"SoftwareSystem","url":null,"views":["shop-containers","checkout"]}],"modelHash":"sha256:79288b1fe9504a57cb949fb0708d2417ec651fc79440eeb9162b6a466fe28ade","relationships":[{"description":"Uses","destination":"shop/web-app","id":"customer->shop/web-app","modelId":"7","properties":{},"source":"customer","tags":["Relationship"],"technology":null},{"description":"Charges cards using","destination":"payments","id":"shop/api->payments","modelId":"10","properties":{},"source":"shop/api","tags":["Relationship"],"technology":null},{"description":"Reads from and writes to","destination":"shop/database","id":"shop/api->shop/database","modelId":"9","properties":{},"source":"shop/api","tags":["Relationship"],"technology":null},{"description":"Calls","destination":"shop/api","id":"shop/web-app->shop/api","modelId":"8","properties":{},"source":"shop/web-app","tags":["Relationship"],"technology":null}],"schema":"buildzr.model/2","views":[{"description":"The containers of the Shop","key":"shop-containers","kind":"container","scene":"v/shop-containers","scope":"shop","title":"The containers of the Shop","viewKey":"shop-containers"},{"description":"A customer checks out","key":"checkout","kind":"dynamic","scene":"v/checkout","scope":"shop","title":"Checkout","viewKey":"checkout"},{"description":"A customer signs in","key":"sign-in","kind":"dynamic","scene":"v/sign-in","scope":"shop","title":"Sign in","viewKey":"sign-in"}],"workspace":{"description":null,"name":"Dynamic steps"}}
