{"deployment":{"environments":[]},"elements":[{"children":[],"description":"Pays invoices online.","group":null,"id":"customer","modelId":"1","name":"Customer","parent":null,"properties":{},"tags":["Element","Person"],"technology":null,"type":"Person","url":null,"views":["landscape","billing-containers"]},{"children":[],"description":"Handles refunds.","group":null,"id":"support-agent","modelId":"2","name":"Support Agent","parent":null,"properties":{},"tags":["Element","Person"],"technology":null,"type":"Person","url":null,"views":["landscape"]},{"children":["billing/web","billing/api","billing/db"],"description":"Invoices customers and takes payments.","group":null,"id":"billing","modelId":"3","name":"Billing","parent":null,"properties":{"owner":"payments-team"},"tags":["Element","Software System"],"technology":null,"type":"SoftwareSystem","url":null,"views":["landscape","billing-containers"]},{"children":[],"description":"Customer billing portal.","group":null,"id":"billing/web","modelId":"4","name":"Web App","parent":"billing","properties":{},"tags":["Element","Container"],"technology":"TypeScript, React","type":"Container","url":null,"views":["billing-containers"]},{"children":["billing/api/invoicer","billing/api/payments","billing/api/ledger-repo"],"description":"Invoicing and payment API.","group":null,"id":"billing/api","modelId":"5","name":"Billing API","parent":"billing","properties":{},"tags":["Element","Container"],"technology":"Go","type":"Container","url":null,"views":["billing-containers"]},{"children":[],"description":"Builds monthly invoices.","group":null,"id":"billing/api/invoicer","modelId":"6","name":"Invoicer","parent":"billing/api","properties":{},"tags":["Element","Component"],"technology":"Go","type":"Component","url":null,"views":[]},{"children":[],"description":"Charges cards.","group":null,"id":"billing/api/payments","modelId":"7","name":"Payments","parent":"billing/api","properties":{},"tags":["Element","Component","PCI"],"technology":"Go","type":"Component","url":null,"views":[]},{"children":[],"description":"Ledger persistence.","group":null,"id":"billing/api/ledger-repo","modelId":"8","name":"Ledger Repo","parent":"billing/api","properties":{},"tags":["Element","Component"],"technology":"Go, sqlc","type":"Component","url":null,"views":[]},{"children":[],"description":"Invoices and ledger.","group":null,"id":"billing/db","modelId":"9","name":"Billing DB","parent":"billing","properties":{},"tags":["Element","Container","Database"],"technology":"PostgreSQL","type":"Container","url":null,"views":["billing-containers"]},{"children":[],"description":"Customer records.","group":null,"id":"crm","modelId":"10","name":"CRM","parent":null,"properties":{},"tags":["Element","Software System","External"],"technology":null,"type":"SoftwareSystem","url":null,"views":["landscape","billing-containers"]},{"children":[],"description":"Sends e-mail.","group":null,"id":"email","modelId":"11","name":"Email","parent":null,"properties":{},"tags":["Element","Software System","External"],"technology":null,"type":"SoftwareSystem","url":null,"views":["landscape"]}],"modelHash":"sha256:06be66564654b8ff9d1a808a6dec5331d1553974daad9d56c9e018c5b454d7dc","relationships":[{"description":"Charges","destination":"billing/api/payments","id":"billing/api/invoicer->billing/api/payments","modelId":"26","properties":{},"source":"billing/api/invoicer","tags":["Relationship"],"technology":null},{"description":"Reads customers","destination":"crm","id":"billing/api/invoicer->crm","modelId":"24","properties":{},"source":"billing/api/invoicer","tags":["Relationship"],"technology":"HTTPS"},{"description":"Sends invoices","destination":"email","id":"billing/api/invoicer->email","modelId":"25","properties":{},"source":"billing/api/invoicer","tags":["Relationship"],"technology":"SMTP"},{"description":"Reads and writes","destination":"billing/db","id":"billing/api/ledger-repo->billing/db","modelId":"28","properties":{},"source":"billing/api/ledger-repo","tags":["Relationship"],"technology":"SQL"},{"description":"Writes payments","destination":"billing/db","id":"billing/api/payments->billing/db","modelId":"27","properties":{},"source":"billing/api/payments","tags":["Relationship"],"technology":"SQL"},{"description":"Calls","destination":"billing/api","id":"billing/web->billing/api","modelId":"22","properties":{},"source":"billing/web","tags":["Relationship"],"technology":"JSON/HTTPS"},{"description":"Submits payment","destination":"billing/api/payments","id":"billing/web->billing/api/payments","modelId":"23","properties":{},"source":"billing/web","tags":["Relationship"],"technology":"JSON/HTTPS"},{"description":"Requests refunds","destination":"billing/api","id":"crm->billing/api","modelId":"29","properties":{},"source":"crm","tags":["Relationship"],"technology":"HTTPS"},{"description":"Pays","destination":"billing/web","id":"customer->billing/web:pays","modelId":"21","properties":{},"source":"customer","tags":["Relationship"],"technology":"HTTPS"},{"description":"Uses","destination":"billing/web","id":"customer->billing/web:uses","modelId":"20","properties":{},"source":"customer","tags":["Relationship"],"technology":"HTTPS"},{"description":"Uses","destination":"crm","id":"support-agent->crm","modelId":"30","properties":{},"source":"support-agent","tags":["Relationship"],"technology":"HTTPS"}],"schema":"buildzr.model/2","views":[{"description":null,"key":"landscape","kind":"systemLandscape","scene":"v/landscape","scope":null,"title":"System landscape","viewKey":"Landscape"},{"description":null,"key":"billing-containers","kind":"container","scene":"v/billing-containers","scope":"billing","title":"Billing - containers","viewKey":"Billing-Containers"}],"workspace":{"description":"Hand-written v4 interface fixture.","name":"Small fixture"}}
